Company	Page	Claim_Text	ESG_Type	Claim_Type	Evidence_Exists	Risk_Signal
Unilever	17	We also reported 57% of our plastic packaging to be reusable, recyclable or compostable.	E	Strong	Yes	Supported
Unilever	17	We will also continue to reduce virgin plastic use.	E	Future Promise	No	Unsubstantiated
Unilever	17	In 2025, we saw an 8% increase in our scope 3 upstream transport and distribution (logistics) emissions compared to the prior year.	E	Strong	Yes	Supported
Unilever	17	This was due to the adoption of the latest Global Logistics Emissions Council (GLEC) framework which resulted in an increase in emission factors.	E	Vague	No	Vague
Unilever	17	Similarly, the use of hydrotreated vegetable oil (HVO) continued to increase in Europe, supporting our transition toward lower-carbon transport solutions.	E	Vague	No	Vague
Unilever	17	In North America, we continued to transition from diesel to renewable natural gas (RNG) on specific lanes, further strengthening our journey toward carbon reduction.	E	Vague	No	Vague
Unilever	17	The impact of the demerger on Unilever’s Climate Transition Action Plan and climate targets will be reassessed in 2026.	E	Future Promise	No	Unsubstantiated
Unilever	17	We invested in the continuous development of sustainable supply chains.	E	Vague	No	Vague
Unilever	17	In addition, we acquired a 14% stake in Lucro Plastecycle Private Limited (Lucro), a leading player in recycled flexible plastics in India, to scale up recycled flexible plastic content in packaging.	E	Strong	Yes	Supported
Unilever	17	As part of our goal to protect and restore 1 million hectares by 2030, this partnership will increase the adaptive capacity and resilience of coastal communities through integrated management and restoration that positively impacts the area, ecosystem health and sustainable use of mangroves.	E	Future Promise	Partial	Weak Evidence
Unilever	17	Additionally, we were part of a business coalition calling for Australia to reduce GHG emissions by 75% by 2035 and featured in The Energy and Resources Institute (TERI) and We Mean Business Coalition’s (WMBC) report on India’s 2035 climate target, highlighting corporate leadership.	E	Future Promise	Partial	Weak Evidence
Unilever	17	■Renewable energy capacity and fossil fuel phase-out: Unilever signed a joint statement coordinated by the RE100, published during the IEA/UK Energy Security Summit, urging ministers and business leaders to prioritise renewables and energy efficiency as pillars of long-term energy security.	E	Vague	No	Vague
Unilever	17	Our Bold Plans, Real Impact report underscores renewables as central to achieving resilient energy systems, as well as the phase-out of fossil fuels and their subsidies.	E	Future Promise	No	Unsubstantiated
Unilever	17	During COP30, we supported the WMBC’s statement urging governments to commit to a roadmap on the transition away from fossil fuels.	E	Vague	No	Vague
Unilever	17	We also joined a group of companies committed to trialling Spheres of Influence, a new framework designed by Oxford Net Zero and Futerra to capture corporate action on climate that goes beyond traditional emissions accounting.	E	Future Promise	No	Unsubstantiated
Unilever	17	■Chemical ingredients: Unilever hosted a policy discussion in Brussels to examine measures advancing the transition to sustainable chemicals in Europe.	E	Vague	No	Vague
Unilever	17	We continued to engage with the Indian government, chairing the Material Transition Working Group of the Resource Efficiency and Circular Economy Industry Coalition (RECEIC).	E	Vague	No	Vague
Unilever	18	Inventories aligned to the scope of our net zero ambition and 2030 climate targets are subsets of the total inventory.	E	Future Promise	No	Unsubstantiated
Unilever	18	As part of our critical assumptions for setting our GHG emission reduction targets, our 2030 modelled outcomes include our 2030 growth trajectories and reflect the expected technology advances, product formulation changes and portfolio shifts in the period.	E	Future Promise	No	Unsubstantiated
Unilever	18	This will be assessed for scope 1, 2 and 3 in 2026 following the demerger.	E	Future Promise	No	Unsubstantiated
Unilever	18	To meet our targets, our actions must deliver the planned reduction in our baseline emissions as well as a 100% reduction in additional emissions from product volume growth between the baseline year and 2030.	E	Future Promise	Partial	Weak Evidence
Unilever	18	We have plans in place to cover 100% of our emissions in scope of our scope 1 and 2 target through three priority decarbonisation levers: thermal and electrical energy, renewable power and refrigeration.	E	Future Promise	Partial	Weak Evidence
Unilever	18	Our current actions only partially address the total emissions in scope of our scope 3 target.	E	Future Promise	No	Unsubstantiated
Unilever	18	Of the identified plans, we expect the most material reductions to come from scope 3 E&I and FLAG emissions related to raw materials and ingredients.	E	Future Promise	No	Unsubstantiated
Unilever	18	(b) The scaling and innovation gap represents the amount of GHG emissions for which we need to develop new or scale existing solutions.	E	Vague	No	Vague
Unilever	18	The demerger of our Ice Cream business has had a marginal impact on our scope 1 and 2 target, with performance slightly lagging that of the rest of Unilever.	E	Future Promise	No	Unsubstantiated
Unilever	19	Allocation is not performed for categories that represent <5% of total emissions, except for Category 13: Downstream leased assets where emissions are allocated in full since they relate to ice cream cabinets.	E	Strong	Yes	Supported
Unilever	19	Scope 3 E&I: The reduction in E&I emissions since 2021 has been driven by a combination of purchased material volume decline, availability of supplier- specific PCFs and improvements in GHG measurement.	E	Vague	No	Vague
Unilever	19	We expect progress against our E&I target to be challenging given the significant contribution from the petrochemicals sector and end-of-life emissions from surfactants.	E	Future Promise	No	Unsubstantiated
Unilever	19	Scope 3 FLAG: The good progress we have made in reducing our FLAG emissions since 2021 has been driven by several factors, including improved data relating to the GHG impact of our deforestation-free sourcing programme for palm oil and the availability of supplier-specific PCFs.	E	Vague	No	Vague
Unilever	19	While separate product-level modelling provides an indication of the potential GHG impact of reformulation initiatives, isolating these effects in our annual GHG results is an area we aim to progress in future years.	E	Future Promise	No	Unsubstantiated
Unilever	20	Ingredients and packaging purchased by Unilever include emissions generated from production and transportation from ’cradle to gate’ (farming/ mining of raw materials to delivery at Unilever).	E	Vague	No	Vague
Unilever	20	Emission factors for ingredients and packaging purchased by Unilever are obtained from two external sources: 1.	E	Vague	No	Vague
Unilever	20	Emission category 10 (Processing of sold products) and Emission category 15 (Investments) are not reported as they are not material.	E	Vague	No	Vague
Unilever	21	Allocation is not performed for categories that represent < 5% of total emissions, except for Category 13: Downstream leased assets where emissions are allocated in full since they relate to ice cream cabinets.	E	Strong	Yes	Supported
Unilever	21	While we continue to deliver underlying reductions in direct emissions through these interventions, our scope 1 emissions have increased due to the reclassification of some on-site, third-party-produced utilities from scope 2 to scope 1.	E	Vague	Partial	Weak Evidence
Unilever	21	Scope 2 emissions have further decreased as we are now sourcing EACs for smaller offices and warehouses.	E	Vague	No	Vague
Unilever	21	Our overall scope 3 emissions have reduced by 5% versus the previous year (including Ice Cream).	E	Strong	Yes	Supported
Unilever	21	The decrease in purchased goods and services emissions is due to factors including a reduction in purchased material volumes and availability of supplier-specific PCFs.	E	Vague	No	Vague
Unilever	21	Scope 3 emissions have increased for upstream transportation and distribution (logistics), primarily due to the update of in-year emission factors.	E	Vague	No	Vague
Unilever	22	Energy consumption and mix Energy sourced from within the organisational boundary is not counted under ’purchased or acquired’ energy.	E	Vague	No	Vague
Unilever	22	EACs are market-based instruments that authenticate the proportion of energy generated from renewable sources procured by consumers, including Renewable Energy Certificates (RECs), International Renewable Energy Certificates (IRECs), and European Guarantees of Origin (GOs).	E	Vague	No	Vague
Unilever	22	A small number of manufacturing sites generate electricity, heat and steam, which is classified as renewable energy if it is from a renewable source.	E	Vague	No	Vague
Unilever	23	gas-fired on-site CHP) 10% 8% Purchased non-renewable electricity (e.g.	E	Strong	Yes	Supported
Unilever	23	GHG removals, and GHG mitigation projects financed through carbon credits Unilever will not purchase carbon credits to meet our near-term targets.	E	Future Promise	No	Unsubstantiated
Unilever	23	When any of our brands do purchase carbon credits, this is considered ’beyond value chain mitigation’ and does not contribute to the achievement of Unilever’s near-term GHG reduction targets.	E	Future Promise	No	Unsubstantiated
Unilever	23	In 2025, one of our Wellbeing brands made consumer-facing claims with reference to scope 1 and 2 carbon neutrality through purchase of carbon credits, and one of our Prestige brands also purchased carbon credits.	E	Future Promise	No	Unsubstantiated
Unilever	23	In addition, while the focus of our CTAP is on emissions reductions within our value chain, we will seek to balance any unabated emissions within the scope of our net zero 2039 ambition with the same volume of purchased carbon removals from 2039.	E	Future Promise	No	Unsubstantiated
Unilever	24	These practices reduce and prevent pollutant emissions and releases to air, land and water.	E	Vague	No	Vague
Unilever	24	Actions Within our own operations, Unilever drives continual improvement in relation to pollution through the ECFWS.	E	Vague	No	Vague
Unilever	24	UMS training and guidance provide a framework for measurement and reporting that supports the identification and reduction of harmful materials.	S	Vague	No	Vague
Unilever	24	Sites periodically develop action plans to improve environmental performance, including pollution control.	E	Future Promise	No	Unsubstantiated
Unilever	24	In 2025, we launched a new global wastewater standard that defines limits for direct discharge of total organic carbon (COD) to the environment.	E	Vague	No	Vague
Unilever	24	We also require suppliers to have management plans for irrigation, pesticide and fertiliser use to avoid contamination and prevent damage to soils, ecosystems and waterways.	E	Future Promise	No	Unsubstantiated
Unilever	24	Our commitment to producing environmentally safe products is core to our decision-making on ingredient use.	E	Vague	No	Vague
Unilever	24	METRICS AND TARGETS Targets Unilever does not have formal targets for pollution emissions defined at a global level.	E	Future Promise	No	Unsubstantiated
Unilever	25	Where laboratory results are below the detection limit, 50% of the detection limit is used in the calculations.	S	Strong	Yes	Supported
Unilever	25	Estimations make up circa 79% of the remaining reported pollutant emissions (2024: 94%).	E	Strong	Yes	Supported
Unilever	25	These differences are expected and have arisen as a result of key improvements in the accuracy and completeness of data collected from sampling, including more precise reporting at sites and more accurate identification of emission point types.	E	Future Promise	No	Unsubstantiated
Unilever	25	(c) Mercury in water (<0.05t) and total phosphorous in soil (17t), have been removed from our reported pollutants as they are below the reporting threshold in 2025 and not considered potentially near or above threshold levels.	E	Strong	Yes	Supported
Unilever	26	Actions Water consumption Within our manufacturing operations, we drive continuous improvement through the implementation and monitoring of site-level water management plans.	E	Future Promise	No	Unsubstantiated
Unilever	26	We seek to minimise water abstraction from shared resources per tonne of production, including reusing and recycling freshwater wherever practical.	E	Vague	No	Vague
Unilever	26	Programmes focus on reducing the water footprint inside factories or replenishing water resources in the surrounding river basin.	E	Vague	No	Vague
Unilever	26	■In 2026, we will continue to onboard new sites in support of our target to implement water stewardship programmes in 100 locations in water- stressed areas by 2030.	G	Future Promise	No	Unsubstantiated
Unilever	26	Reducing product demand To respond to changes in water access, we invest in water-smart products and formulations that deliver superior performance to our customers even in countries with high water stress.	E	Vague	No	Vague
Unilever	26	METRICS AND TARGETS Targets We do not have formal targets on water withdrawal in our own operations or upstream value chain.	E	Future Promise	No	Unsubstantiated
Unilever	26	Water withdrawal from our own operations is addressed through our manufacturing processes and measured against local environmental performance targets, rather than global targets.	E	Future Promise	No	Unsubstantiated
Unilever	26	Further, we do not have targets on water- smart product design.	E	Future Promise	No	Unsubstantiated
Unilever	26	Unilever’s target is to implement water stewardship programmes in 100 locations in water-stressed areas by 2030, in line with our Environmental Policy.	E	Future Promise	No	Unsubstantiated
Unilever	26	In 2026, we will update this target to focus our impact with the aim of implementing stewardship programs for 100% of our production sites located in water-stressed areas by 2030.	E	Future Promise	Partial	Weak Evidence
Unilever	27	For sites where this information is not collected (representing 2% of water consumption), consumption is estimated based on site headcount, pallet positions and proxy data.	E	Strong	Yes	Supported
Unilever	27	Unilever sites in areas at water risk, including areas of high water stress, are identified using the World Resources Institute (WRI) Aqueduct Water Risk Atlas tool.	E	Vague	No	Vague
Unilever	27	Water recycled and reused is measured via meter readings (78%) or through a water mass balance (22%) at all manufacturing sites and the majority of logistics and other sites.	E	Strong	Yes	Supported
Unilever	28	To reach this conclusion, we identified sites within a 1km radius of biodiversity-sensitive areas to capture Unilever’s likely direct and indirect impacts and allow for comparability across our sites.	E	Vague	No	Vague
Unilever	28	The selected nature scenarios align with our climate scenarios based on their temperature goals and policy ambitions.	E	Future Promise	No	Unsubstantiated
Unilever	28	Environmental pressures pose significant risks to supply chain stability and productivity, affecting crop yields, raw material availability and long-term sourcing strategies.	E	Vague	No	Vague
Unilever	28	These regenerative agriculture programmes build on our sustainable sourcing programmes, strengthening supplier practices and reducing risks linked to agricultural commodity dependence.	E	Vague	No	Vague
Unilever	28	In 2025, we began developing an updated nature strategy in line with the ACT-D (Assess, Commit, Transform, Disclose) framework that seeks to recognise and leverage the interconnected challenges of climate, biodiversity, livelihoods and pollution to ensure an integrated approach.	E	Vague	No	Vague
Unilever	28	Unilever does not have a dedicated biodiversity and ecosystem protection policy focused specifically on impacts from operational sites in or near biodiversity-sensitive areas.	E	Vague	No	Vague
Unilever	29	Actions Our actions and resources focus on four priority strategic areas and address our material nature-related impacts, dependencies and risks.	E	Vague	No	Vague
Unilever	29	Sustainable sourcing In 2025, we sourced 81% of our key crops sustainably; this includes 19% via purchased sustainability credits.	E	Strong	Yes	Supported
Unilever	29	Our goal is to source 95% of our key crops sustainably by 2030.	E	Future Promise	Partial	Weak Evidence
Unilever	29	This action incorporates local and Indigenous knowledge and nature-based solutions through the requirements embedded within our SAP.	E	Vague	No	Vague
Unilever	29	Deforestation-free supply chains In 2025, we exceeded 95% purchase volumes of palm oil, paper and board, tea, soy and cocoa as deforestation-free, based on Unilever’s requirements.	G	Strong	Yes	Supported
Unilever	29	This supply chain collaboration enhances our impact and allows us to maintain and grow deforestation- free sources.	E	Vague	No	Vague
Unilever	29	We have continued to invest in the verification of suppliers against our Independent Verification Protocols, expanding the implementation of our deforestation-free sourcing programme, addressing risk, and ensuring the resilience of our supply chain and supporting ecosystems.	E	Vague	No	Vague
Unilever	29	Our deforestation-free landscape strategy also includes empowerment and inclusion of smallholders in our supply chain, through direct sourcing approaches as well as working across landscapes.	E	Vague	No	Vague
Unilever	29	In 2025, Unilever continued to increase the number of palm oil smallholder farmers across Indonesia trained in sustainable agricultural practices, with around 29,500 trained since January 2024.	E	Vague	No	Vague
Unilever	29	In addition, as part of our inclusive sourcing initiative, we have now mapped over 55,000 palm smallholder farmers, while further supporting RSPO smallholder certification across our palm supply base.	S	Vague	No	Vague
Unilever	29	In 2026, we will further extend our deforestation-free verification programme to additional sources and suppliers, with a particular focus on independent mills.	E	Future Promise	No	Unsubstantiated
Unilever	29	Here, we actively supported programmes leveraging multi-stakeholder collaboration, such as the Coalition for Sustainable Livelihoods to protect the Leuser Ecosystem and Conservation International in the Tapanuli Selatan region.	S	Vague	No	Vague
Unilever	29	Specific actions for 2026 include scaling up our Mangrove Initiative for people, climate and nature in Ecuador, which we are delivering with Conservation International, the Green Climate Fund (GCF) and the Government of Ecuador.	E	Vague	No	Vague
Unilever	29	Policy recommendations, including scaling up incentives in support of regenerative practices, were shared with the Brazilian Government.	G	Vague	No	Vague
Unilever	29	■Climate Week NYC and COP30: The need to create a regulatory landscape that supports farmers to transition to, and maintain, regenerative approaches was further reinforced at Climate Week NYC and COP30.	E	Vague	No	Vague
Unilever	30	Our sustainable sourcing and regenerative agriculture targets aim to address the impact of ecosystem degradation, potential crop yield reduction, and biodiversity loss or collapse within our value chain.	E	Future Promise	No	Unsubstantiated
Unilever	30	Our protect and restore and no-deforestation targets represent a unified approach to ecosystem intervention, aiming to address biodiversity loss risks and potential regulatory or activist challenges in areas surrounding our value chain.	E	Future Promise	No	Unsubstantiated
Unilever	30	After achieving 97.5% deforestation-free sourcing of our five primary deforestation-linked commodities (palm oil, paper and board, tea, soy and cocoa) in 2023, we set a new goal to maintain 95% deforestation-free sourcing.	G	Future Promise	Partial	Weak Evidence
Unilever	30	Target-setting was informed by, but not aligned with, the Kunming-Montreal Global Biodiversity Framework, and all our targets can be allocated to the avoidance, minimisation, restoration, and rehabilitation layers of the mitigation hierarchy.	E	Future Promise	No	Unsubstantiated
Unilever	30	Measuring performance against this target includes the partial use of credits to address the unavailability of physically sustainable (certified) sources in some markets.	E	Future Promise	Partial	Weak Evidence
Unilever	30	These credits are compensatory and not associated with providing biodiversity improvements.	E	Vague	No	Vague
Unilever	30	Maintain no deforestation across our primary deforestation-linked commodities Performance is measured as the percentage of volumes purchased of palm oil, paper and board, tea, soy and cocoa that meet Unilever’s deforestation-free requirements in the period from 1 January to 31 December 2025.	G	Vague	No	Vague
Unilever	31	In addition, we continued to deliver ahead of our goal to maintain 95% purchase volumes as deforestation-free.	E	Future Promise	Partial	Weak Evidence
Unilever	31	Our performance against our sustainable sourcing target is in line with expectation, as there has been a decline in some portfolios (dairy, sugar and cocoa) offset by improvements in others (starches and cereals).	E	Future Promise	No	Unsubstantiated
Unilever	31	As the majority of cocoa volumes relate to Ice Cream, we will review the scope of our targets in 2026 and update our key crops accordingly.	E	Future Promise	No	Unsubstantiated
Unilever	31	A Protected Area (PA) is a clearly defined geographical space recognised, dedicated and managed through legal or other effective means to achieve the long-term conservation of nature, along with associated ecosystem services and cultural values.	E	Vague	No	Vague
Unilever	31	We undertook a comprehensive review of our site list to clarify ownership structures and operating status which led to a reduction in the number of sites in scope.	E	Vague	No	Vague
Unilever	32	Our policies in relation to plastic packaging encompass the reduction in our use of virgin plastics, and our policies in relation to hazardous waste encompass waste management.	E	Vague	No	Vague
Unilever	32	To date, we have driven the majority of our virgin plastic reduction through the use of post-consumer recycled plastic (PCR).	E	Vague	No	Vague
Unilever	32	We delivered this through close collaboration with our network of PCR suppliers and our Business Groups to increase PCR levels.	S	Vague	No	Vague
Unilever	32	For example, following significant technical advances with suppliers to unlock the supply of high-quality recycled plastic, our Wonder Wash laundry detergent bottles in the UK and Europe, and our Hellmann’s Squeeze bottles in Brazil, now contain up to 100% PCR (excluding lids and caps).	E	Strong	Yes	Supported
Unilever	32	To achieve this, we have expanded partnerships with waste management providers and community-based collection systems, such as those with Lohjinawi and Persada in Indonesia.	E	Vague	No	Vague
Unilever	32	We continue to improve recyclability in practice and further increase access to recycled content through advocacy and targeted investments.	E	Future Promise	No	Unsubstantiated
Unilever	32	For example, through Circulate Capital’s Ocean Fund, we are investing in waste collection infrastructure in places like India, Indonesia and Latin America.	E	Vague	No	Vague
Unilever	32	We are continuing to develop next-generation packaging solutions that are reusable, recyclable or compostable, while reducing the virgin plastic we use.	E	Vague	No	Vague
Unilever	32	Our Packaging R&D team is actively developing new flexible packaging materials that are recyclable and/or compostable, and in 2026 we will update our targets to increase focus on our transition to paper-based flexible packaging.	E	Future Promise	No	Unsubstantiated
Unilever	32	For rigid plastic packaging, in 2025, we focused on increasing the roll-out of reusable plastic packaging.	E	Vague	No	Vague
Unilever	32	For example, in the UK we launched Cif’s Infinite Clean all-in-one spray, which uses a reusable trigger spray that reduces plastic waste by 50%.	E	Strong	Yes	Supported
Unilever	32	Waste management, including hazardous waste We drive continuous improvement in waste management at our sites, including hazardous waste, through the Environmental Care Framework Standard (ECFWS).	E	Vague	No	Vague
Unilever	32	Periodically, sites develop action plans to improve environmental performance, including waste management, and monitor progress throughout the year to ensure the timely closure of actions.	E	Future Promise	No	Unsubstantiated
Unilever	32	To reduce our waste footprint, the standard also requires sites to maintain zero non-hazardous waste from manufacturing to landfill or incineration without energy recovery.	E	Vague	No	Vague
Unilever	32	Unilever has maintained zero non-hazardous waste to landfill since 2015; we consider this to be maintained when less than 0.5% of non-hazardous waste is disposed to landfill.	E	Strong	Yes	Supported
Unilever	32	METRICS AND TARGETS Targets Our plastic packaging targets focus on the areas we know will have the most impact such as reducing our use of virgin plastic and developing solutions for hard-to-recycle flexible plastic packaging materials, like sachets.	E	Future Promise	No	Unsubstantiated
Unilever	32	These voluntary targets are in line with Unilever’s Environmental Policy.	E	Future Promise	No	Unsubstantiated
Unilever	32	We aim to address plastic pollution by reducing our virgin plastic usage and working to keep plastic in circulation.	E	Future Promise	No	Unsubstantiated
